{
  "schema": "rkf-evidence-artifact-v1",
  "evidence_id": "pdf_doi_10_1029_2024jd042375",
  "source_id": "doi_10_1029_2024jd042375",
  "artifact_type": "pdf",
  "status": "pdf_qc_done",
  "qc_status": "codex_qc_done",
  "storage_path": "PRIVATE_EVIDENCE_ROOT/doi_pdf/doi_10_1029_2024jd042375.pdf",
  "public_safe_pointer": "private_evidence/doi_pdf/doi_10_1029_2024jd042375.pdf",
  "locators": [
    "JGR PDF pp. 1-2: title, key points, abstract, and TAHOPE/PRECIP IOP2 campaign context",
    "JGR PDF pp. 7-14: merged ZDR columns, vertical velocity, graupel, and storm intensification locators"
  ],
  "created": "2026-05-24",
  "updated": "2026-05-24"
}
